{
  "artifact_sha256": "3333333333333333333333333333333333333333333333333333333333333333",
  "build_commit": "0000000000000000000000000000000000000000",
  "config_bundle_sha256": "2222222222222222222222222222222222222222222222222222222222222222",
  "contract_manifest_sha256": "1111111111111111111111111111111111111111111111111111111111111111",
  "emitted_at_us": 1786156800123456,
  "event_id": "evt_triad_outcome_v2",
  "event_kind": "OUTCOME",
  "payload": {
    "arm_attribution": {},
    "campaign_id": "x",
    "campaign_state": "OPEN",
    "capsule_attribution": {},
    "concentration_unit": "x",
    "duration_us": 1786156800123456,
    "emergency_cost": "x",
    "fees": "0",
    "fills": [],
    "funding": "0",
    "gross_pnl": "0",
    "liquidation_adl_cost": "x",
    "mae": "0",
    "markouts": [],
    "mfe": "0",
    "net_pnl": "0",
    "quantity_conservation": {},
    "rebates": "0",
    "reconciliation_state": "x",
    "regime_attribution": {},
    "valuation_evidence": {}
  },
  "producer_epoch": "42",
  "producer_instance_id": "inst_golden_01",
  "producer_service": "triad-e10",
  "schema": "triad.outcome.v2",
  "schema_version": "2.0.0"
}
